{
  "schema_version": "1.1",
  "catalog_id": "pytorch_cpp_strategy_primitives",
  "catalog_version": 6,
  "target_language": "cpp",
  "template_interface": {
    "template_ref": {
      "artifact_id": "libfuzzer_harness_v1",
      "artifact_version": 1,
      "content_hash": "a2fc89fc6804d456b777a23f8e58dd30b9f5ab60a3c697bfde3e2e79331240d8"
    },
    "available_slots": [
      "input_construction",
      "pre_call_transform",
      "pre_call_guard",
      "pre_call_observation",
      "target_call",
      "post_call_observation",
      "oracle_check",
      "artifact_logging",
      "cleanup"
    ],
    "built_in_values": [
      {
        "value_id": "data",
        "value_kind": "raw_bytes",
        "description": "LibFuzzer input bytes."
      },
      {
        "value_id": "size",
        "value_kind": "integer",
        "description": "LibFuzzer input size."
      },
      {
        "value_id": "offset",
        "value_kind": "byte_cursor",
        "description": "Cursor after the branch selector byte."
      },
      {
        "value_id": "selector",
        "value_kind": "integer",
        "description": "Branch selector byte."
      },
      {
        "value_id": "none",
        "value_kind": "optional_value",
        "description": "Explicit C++ null optional value for an API parameter that accepts None."
      }
    ]
  },
  "primitives": [
    {
      "primitive_id": "construct_tensor_from_fuzz",
      "primitive_kind": "value_construct",
      "summary": "Construct a bounded CPU tensor whose shape and values depend on fuzz bytes.",
      "semantic_support": {
        "predicate_ids": [],
        "condition_roles": [],
        "observation_phases": [],
        "behavior_check_levels": [],
        "subject_kinds": [
          "tensor"
        ],
        "fuzz_dependency": "produces"
      },
      "allowed_template_slots": [
        "input_construction"
      ],
      "input_contract": [
        {
          "port_id": "data",
          "accepted_value_kinds": [
            "raw_bytes"
          ],
          "required": true
        },
        {
          "port_id": "size",
          "accepted_value_kinds": [
            "integer"
          ],
          "required": true
        },
        {
          "port_id": "cursor",
          "accepted_value_kinds": [
            "byte_cursor"
          ],
          "required": true
        }
      ],
      "output_contract": [
        {
          "port_id": "tensor",
          "produced_value_kind": "tensor",
          "binding_required": true
        },
        {
          "port_id": "next_cursor",
          "produced_value_kind": "byte_cursor",
          "binding_required": true
        }
      ],
      "parameter_contract": [
        {
          "parameter_id": "dtype_policy",
          "value_kind": "string",
          "required": true,
          "allowed_binding_kinds": [
            "literal"
          ],
          "allowed_values": [
            "float32",
            "int64",
            "bool"
          ]
        },
        {
          "parameter_id": "max_dimension",
          "value_kind": "integer",
          "required": true,
          "allowed_binding_kinds": [
            "literal"
          ],
          "allowed_values": [
            1,
            2,
            4,
            8,
            16
          ]
        },
        {
          "parameter_id": "minimum_dimension",
          "value_kind": "integer",
          "required": false,
          "allowed_binding_kinds": [
            "literal"
          ],
          "allowed_values": [
            0,
            1
          ]
        }
      ],
      "outcome_contract": {
        "failure_outcomes": [
          {
            "outcome_id": "insufficient_fuzz_data",
            "description": "Fewer than three bytes remain at the input cursor.",
            "terminal_action": "reject_input"
          }
        ]
      },
      "implementation_binding": {
        "kind": "generator_native",
        "emitter_id": "emit_construct_tensor_from_fuzz",
        "helper_profile_ref": null
      },
      "limitations": [
        "CPU tensors only; rank and dimension sizes are bounded by experiment policy rather than API facts."
      ]
    },
    {
      "primitive_id": "construct_tensor_with_constraints",
      "primitive_kind": "value_construct",
      "summary": "Construct a bounded CPU tensor from a shape template with fuzz-derived dimensions or values.",
      "semantic_support": {
        "predicate_ids": [
          "property_relation",
          "range_constraint"
        ],
        "condition_roles": [
          "activation_required",
          "exploration_variable"
        ],
        "observation_phases": [
          "before_target_api_call"
        ],
        "behavior_check_levels": [],
        "subject_kinds": [
          "tensor"
        ],
        "fuzz_dependency": "produces"
      },
      "allowed_template_slots": [
        "input_construction"
      ],
      "input_contract": [
        {
          "port_id": "data",
          "accepted_value_kinds": [
            "raw_bytes"
          ],
          "required": true
        },
        {
          "port_id": "size",
          "accepted_value_kinds": [
            "integer"
          ],
          "required": true
        },
        {
          "port_id": "cursor",
          "accepted_value_kinds": [
            "byte_cursor"
          ],
          "required": true
        }
      ],
      "output_contract": [
        {
          "port_id": "tensor",
          "produced_value_kind": "tensor",
          "binding_required": true
        },
        {
          "port_id": "next_cursor",
          "produced_value_kind": "byte_cursor",
          "binding_required": true
        }
      ],
      "parameter_contract": [
        {
          "parameter_id": "shape_template",
          "value_kind": "shape",
          "required": true,
          "allowed_binding_kinds": [
            "literal",
            "spec_parameter"
          ]
        },
        {
          "parameter_id": "dtype_policy",
          "value_kind": "string",
          "required": true,
          "allowed_binding_kinds": [
            "literal"
          ],
          "allowed_values": [
            "float32",
            "int64",
            "bool"
          ]
        },
        {
          "parameter_id": "fill_policy",
          "value_kind": "string",
          "required": true,
          "allowed_binding_kinds": [
            "literal"
          ],
          "allowed_values": [
            "zero",
            "fuzz_numeric",
            "fuzz_sign"
          ]
        },
        {
          "parameter_id": "max_dimension",
          "value_kind": "integer",
          "required": true,
          "allowed_binding_kinds": [
            "literal"
          ],
          "allowed_values": [
            1,
            2,
            4,
            8,
            16
          ]
        },
        {
          "parameter_id": "minimum_dimension",
          "value_kind": "integer",
          "required": false,
          "allowed_binding_kinds": [
            "literal"
          ],
          "allowed_values": [
            0,
            1
          ]
        }
      ],
      "outcome_contract": {
        "failure_outcomes": []
      },
      "implementation_binding": {
        "kind": "generator_native",
        "emitter_id": "emit_construct_tensor_with_constraints",
        "helper_profile_ref": null
      },
      "limitations": [
        "Shape templates contain zero to four dimensions; -1 denotes a fuzz-derived bounded dimension that may be zero."
      ]
    },
    {
      "primitive_id": "construct_tensor_with_rank_range",
      "primitive_kind": "value_construct",
      "summary": "Construct a bounded CPU tensor with a fuzz-selected rank and fuzz-derived dimensions or values.",
      "semantic_support": {
        "predicate_ids": ["property_relation", "range_constraint", "cross_subject_relation"],
        "condition_roles": ["activation_required", "exploration_variable"],
        "observation_phases": ["before_target_api_call"],
        "behavior_check_levels": [],
        "subject_kinds": ["tensor"],
        "fuzz_dependency": "produces"
      },
      "allowed_template_slots": ["input_construction"],
      "input_contract": [
        {"port_id": "data", "accepted_value_kinds": ["raw_bytes"], "required": true},
        {"port_id": "size", "accepted_value_kinds": ["integer"], "required": true},
        {"port_id": "cursor", "accepted_value_kinds": ["byte_cursor"], "required": true}
      ],
      "output_contract": [
        {"port_id": "tensor", "produced_value_kind": "tensor", "binding_required": true},
        {"port_id": "next_cursor", "produced_value_kind": "byte_cursor", "binding_required": true}
      ],
      "parameter_contract": [
        {"parameter_id": "minimum_rank", "value_kind": "integer", "required": true, "allowed_binding_kinds": ["literal"], "allowed_values": [0, 1, 2, 3, 4]},
        {"parameter_id": "maximum_rank", "value_kind": "integer", "required": true, "allowed_binding_kinds": ["literal"], "allowed_values": [0, 1, 2, 3, 4]},
        {"parameter_id": "dtype_policy", "value_kind": "string", "required": true, "allowed_binding_kinds": ["literal"], "allowed_values": ["float32", "int64", "bool"]},
        {"parameter_id": "fill_policy", "value_kind": "string", "required": true, "allowed_binding_kinds": ["literal"], "allowed_values": ["zero", "fuzz_numeric", "fuzz_sign"]},
        {"parameter_id": "max_dimension", "value_kind": "integer", "required": true, "allowed_binding_kinds": ["literal"], "allowed_values": [1, 2, 4, 8, 16]},
        {"parameter_id": "minimum_dimension", "value_kind": "integer", "required": false, "allowed_binding_kinds": ["literal"], "allowed_values": [0, 1]}
      ],
      "outcome_contract": {"failure_outcomes": []},